{
  "$schema": "urn:prism:schema:v1:spec",
  "title": "Stage funnel",
  "data": {
    "name": "funnel",
    "values": [
      {"stage": "view",     "count": 1000},
      {"stage": "engage",   "count":  640},
      {"stage": "purchase", "count":  120}
    ]
  },
  "mark": "funnel",
  "encoding": {
    "theta": {"field": "count", "type": "quantitative"},
    "color": {"field": "stage", "type": "nominal"}
  }
}
