{
  "$schema": "urn:prism:schema:v1:spec",
  "title": "Swap bars (animated)",
  "description": "Edit any value below and the bars tween to their new heights. Try changing alpha's score from 0.42 to 0.95 — the bar grows in 600ms instead of snapping. The `animation` block plus `key: true` on the x channel turn each per-render swap into a tween.",
  "data": {
    "name": "brand_scores",
    "values": [
      {"brand_id": "alpha",   "score": 0.42},
      {"brand_id": "beta",    "score": 0.71},
      {"brand_id": "gamma",   "score": 0.58},
      {"brand_id": "delta",   "score": 0.33},
      {"brand_id": "epsilon", "score": 0.65}
    ]
  },
  "mark": {"type": "bar", "corner_radius": 4},
  "encoding": {
    "x":     {"field": "brand_id", "type": "nominal", "key": true},
    "y":     {"field": "score",    "type": "quantitative", "scale": {"domain": [0, 1]}},
    "color": {"field": "brand_id", "type": "nominal"}
  },
  "animation": {"duration_ms": 600, "easing": "cubic_in_out"}
}
