{
  "$schema": "urn:prism:schema:v1:spec",
  "title": "Sparkline (12-week trend)",
  "data": {
    "name": "trend",
    "values": [
      {"t": 0,  "v": 12},
      {"t": 1,  "v": 18},
      {"t": 2,  "v": 15},
      {"t": 3,  "v": 22},
      {"t": 4,  "v": 28},
      {"t": 5,  "v": 24},
      {"t": 6,  "v": 31},
      {"t": 7,  "v": 27},
      {"t": 8,  "v": 35},
      {"t": 9,  "v": 30},
      {"t": 10, "v": 38},
      {"t": 11, "v": 42}
    ]
  },
  "mark": "sparkline",
  "encoding": {
    "x": {"field": "t", "type": "quantitative"},
    "y": {"field": "v", "type": "quantitative"}
  }
}
